Filename,Transcription,Seed_Phrase,seed1,seed2,seed3,seed4,seed5,seed6,seed7,seed8,seed9,Context,Intent,WEM number,Thinking,Count
197643865.WEM,Pulse Drive Engaged,"Pulse drive engaged, turbulence is expected.",,,,,,,,,,Starship Movement,Your ship has activated its pulse drive for rapid travel within the solar system.,197643865,Yes,2
294741566.wem,Local enemy disruption,"Hostile forces are using a pulse disrupter, you are limited to standard flight speeds.",,,,,,,,,,Starship Movement,"Enemy interference is disabling faster flight options, restricting your speed.",294741566,Yes,2
375834098.wem,Landing sequence initiated,Attempting to land the spaceship safely.,,,,,,,,,,Starship Movement,The landing procedure has started and the ship is descending for touchdown.,375834098,Yes,2
393574373.wem,Planetary interference,"You are too close to the planet, relocate before retrying the manouever.",,,,,,,,,,Starship Movement,You need to increase distance from the planet before attempting deep space maneuvers again due to atmospheric interference.,393574373,,2
422143449.WEM,Landing Area Not Clear,"Landing area not clear, try somewhere else.",,,,,,,,,,Starship Movement,The designated landing area is obstructed or unsafe for landing. you must find an alternative safe location.,422143449,Yes,2
469963216.WEM,Initiating Landing Sequence,Guidance computer is taking over for an automated landing sequence.,,,,,,,,,,Starship Movement,The guidance computer has assumed control to perform an automated landing sequence.,469963216,Yes,2
556538925.wem,Large ship proximity,"You are too close to a major gravitational source, Relocate to open space and try again.",,,,,,,,,,Starship Movement,Proximity to a large ship or gravity well is unsafe for the current starship action.,556538925,Yes,2
629992665.wem,Atmospheric interference,Atmospheric interference is preventing you from taking that action. Relocate to empty void and try again.,,,,,,,,,,Starship Movement,Atmospheric conditions are obstructing your attempted starship manouver.,629992665,Yes,2
769872372.wem,Large ship proximity,That action is triggereng the emergency stop protocol due to gravity well proximity.,,,,,,,,,,Starship Movement,The attempted action is prevented by proximity to a large ship's gravity well.,769872372,,2
824079454.wem,Space station proximity,"The laws of physics have denied your request, Relocate before making another attempt at that manouevre.",,,,,,,,,,Starship Movement,Physical constraints prevent your action due to being too close to a space station.,824079454,Yes,2
460766259.wem,*random autophage*,*random autophage*,,,,,,,,,,REFERENCE,"UNUSED AT THIS TIME, LEAVE WEM NUMBER BLANK",,,
487346738.wem,*random autophage*,*random autophage*,,,,,,,,,,REFERENCE,"UNUSED AT THIS TIME, LEAVE WEM NUMBER BLANK",,,
61285078.wem,*random autophage*,*random autophage*,,,,,,,,,,REFERENCE,"UNUSED AT THIS TIME, LEAVE WEM NUMBER BLANK",,,
836418899.wem,*random autophage*,*random autophage*,,,,,,,,,,REFERENCE,"UNUSED AT THIS TIME, LEAVE WEM NUMBER BLANK",,,
862236259.wem,*random autophage*,*random autophage*,,,,,,,,,,REFERENCE,"UNUSED AT THIS TIME, LEAVE WEM NUMBER BLANK",,,
946171572.wem,*random autophage*,*random autophage*,,,,,,,,,,REFERENCE,"UNUSED AT THIS TIME, LEAVE WEM NUMBER BLANK",,,
998327261.wem,*random autophage*,*random autophage*,,,,,,,,,,REFERENCE,"UNUSED AT THIS TIME, LEAVE WEM NUMBER BLANK",,,
752301356.WEM,*random autophage*,*random autophage*,,,,,,,,,,REFERENCE,"UNUSED AT THIS TIME, LEAVE WEM NUMBER BLANK",,,
