Filename,Transcription,Seed_Phrase,seed1,seed2,seed3,seed4,seed5,seed6,seed7,seed8,seed9,Context,Intent,WEM number,Thinking,Count
48466939.WEM,Freighter Warp Initiated,A hostile capital ship has initiated warp and is attempting to escape.,,,,,,,,,,Freighter Combat,An attacking freighter has engaged warp engines and is attempting to flee.,48466939,Yes,2
80959229.WEM,Missile Locked,The hostile missile has locked on to a target.,,,,,,,,,,Freighter Combat,"A missile launched from a hostile ship is locked on to a civilian freighter under your protection, posing an imminent threat.",80959229,,2
167092968.WEM,Incoming Missiles Destroyed,All incoming hostile missiles have been destroyed.,,,,,,,,,,Freighter Combat,All incoming hostile missiles targeting you or allies have been destroyed. Confirmed total missile defense success.,167092968,,2
241169623.WEM,Missiles Destroyed,All incoming hostile missiles have been destroyed.,,,,,,,,,,Freighter Combat,"All incoming hostile missiles have been destroyed, removing the missile threat to you and allied forces.",241169623,,2
278919221.wem,Hyperdrive damage is critical,"Damage to the hyperdrive is extensive, attempting a jump will result in unpleasant terminal consequences.",,,,,,,,,,Freighter Combat,A freighter ship is attempting a hyperspace jump and will likely encounter catastrophic failure due to a critically damaged hyperdrive.,278919221,Yes,2
311554138.WEM,Warping,"Jumping to hyperspace, fasten your seatbelts and confirm your space-sickness bag is ready.",,,,,,,,,,Freighter Combat,"A warp jump is underway, prepare for space travel discomfort.",311554138,Yes,2
389592073.WEM,Incoming Missiles Neutralized,All incoming hostile missiles have been neutralized.,,,,,,,,,,Freighter Combat,All incoming missile from hostile ships aimed at your allies and civilian freighters have been neutralized.,389592073,,2
449779025.WEM,Incoming Missile Destroyed,The hostile incoming missile has been destroyed.,,,,,,,,,,Freighter Combat,A missile from a hostile ship aimed at a civilian freighter under your protection has been successfully destroyed before impact.,449779025,,2
459254064.WEM,Missile Inbound: Impact Imminent,"Hostile missile inbound, civilian freighter impact imminent.",,,,,,,,,,Freighter Combat,A hostile missile is inbound with impact imminent on a civilian freighter under your protection.,459254064,,2
565386800.WEM,Jump Engaged,"Jump engines engaged, transition to Hyperspace is imminent.",,,,,,,,,,Freighter Combat,"A hostile capital freighter has engaged it's Jump drive, and hyperspace transition is imminent.",565386800,Yes,2
597203928.WEM,Warp Engaged,"Warp drives powering up, prepare for jump to hyperspace.",,,,,,,,,,Freighter Combat,A hostile capital freigher's warp system is activating and a jump is imminent.,597203928,Yes,2
672799524.WEM,Missiles Neutralized,All Incoming hostile missiles have been neutralized.,,,,,,,,,,Freighter Combat,All missiles launched from hostile ships aimed at civilian freighters and allied fores under your protection have been neutralized.,672799524,,2
695050944.WEM,Missile Destroyed,The hostile incoming missile has been destroyed.,,,,,,,,,,Freighter Combat,A missile from a hostile ship aimed at a civilian freighter under your protection has been destroyed.,695050944,,2
756031301.WEM,Incoming Missile,"Civilian freighter distress signal, incoming missile.",,,,,,,,,,Freighter Combat,A civilian freighter is emitting a distress signal due to an incoming pirate attack. The freighter is asking for your assistance.,756031301,,2
776652442.WEM,Enemy Missile Incoming,"Civilian freighter is in imminint danger of enemy missile impact, ",,,,,,,,,,Freighter Combat,A civilian freighter under your protection is imminently threatened by an enemy missile launch.,776652442,,2
972765308.WEM,Missile Locked And Ready,"Hostile missile locked, civilian freighter targeted.",,,,,,,,,,Freighter Combat,A hostile missile has locked onto a civilian target. The targeted freighter is under your protection.,972765308,,2
159011641.WEM,Transferred,Something has been transferred from one inventory space to another.,,,,,,,,,,Inventory,An inventory item has been moved from slot or container to another slot or container.,159011641,,2
200893742.WEM,No Free Slots In Ship Inventory,You have no physical space available to store more items in your ship cargo holds.,,,,,,,,,,Inventory,The ship's inventory is full. No additional items can be stored until space is cleared.,200893742,,2
303147008.WEM,Units Depleted,Cash reserves have been depleted. Your account is now empty.,,,,,,,,,,Inventory,You have no money. Your Currency balance has dropped to zero; further purchases can not be made until you bring your balance above zero.,303147008,,2
431813574.WEM,Inventory Contents Transferred,Your selected inventory contents have been transferred to a new storage location.,,,,,,,,,,Inventory,Selected inventory contents have been moved to a new storage location or compartment. ,431813574,,2
665195778.WEM,New Inventory Slots Available,"New inventory slots have been installed for your suit, this means you have more pockets!",,,,,,,,,,Inventory,"Additional inventory slots have been installed in your suit, increasing carrying capacity.",665195778,Yes,2
682086836.WEM,Item Received,You have recieved an item.,,,,,,,,,,Inventory,"You have received an item, which is now added to your inventory.",682086836,,2
750398819.WEM,Product Transferred,A product has been transferred from one of your inventory spaces to a different inventory space.,,,,,,,,,,Inventory,An item has been moved from one inventory container to another.,750398819,,2
769144390.WEM,Insufficient Resources,You are attempting an action that requires a minimum accumulation of specified resources.,,,,,,,,,,Inventory,you have attempted an action requiring resources you do not currently possess in sufficient quantity.,769144390,,2
911201958.WEM,Insufficient Units,You do not have enough monetary units to make this purchase.,,,,,,,,,,Inventory,your monetary units are insufficient to complete a purchase.,911201958,,2
925087453.WEM,Element Resources Successfully Transferred To Ship Inventory,Selected resources have been transferred to the ship cargo hold.,,,,,,,,,,Inventory,Selected resources have been successfully transferred to the ship’s cargo hold.,925087453,,2
969545875.WEM,Element Resources Successfully Transferred,Your selected inventory items have been transferred to alternate inventory storage.,,,,,,,,,,Inventory,Selected inventory items have been successfully transferred to an alternate unspecified storage space.,969545875,,2
985789170.WEM,Product Constructed,"A product has been constructed, you may use it or sell it as needed.",,,,,,,,,,Inventory,"You have successfully fabricated a product, it is now stored in your inventory.",985789170,,20
243520476.WEM,Orbital Station Coordinates Received,Your navigation computer has received new Orbital Station Coordinates.,,,,,,,,,,Navigation,New coordinates for a previously unvisited orbital station have been uploaded to your navigation system.,243520476,Yes,2
288672024.WEM,Distress Signal Detected,"Another entity's distress beacon signal has been traced to the origin, coordinates are added to your navigation computer. ",,,,,,,,,,Navigation,Your navigation computer has detected and traced a distress signal from another entity. Coordinates of the signal’s origin have been added to navigation systems for potential response.,288672024,Yes,2
334124591.WEM,Base Out Of Range,"You have travelled beyond the limits of the legally claimed region of your base, build options will be limited.",,,,,,,,,,Navigation,"You have traveled outside the legally claimed region boundaries of your base. This limits building options in the current area. Outside the base, there are a only a handful of small portble items availabe to be constructed and placed.",334124591,Yes,2
436192208.WEM,Starship Signal Detected,"A starship has been detected, coordinates have been added to your navigation database.",,,,,,,,,,Navigation,"A signal has been detected that may be of interest to you, it appears to match a standard starship distress frequency. Navigation coordinates are marked should you wish to investigate.",436192208,Yes,3
545382948.WEM,Sigil Trait Module Located,"A module for sigil traits has been located, stand by for details.",,,,,,,,,,Navigation,"A rare upgrade module relevant to Sigil Traits has been found, it awaits your interaction.",545382948,Yes,2
705081998.wem,Anomoly detected,An anomoly has been detected that may be worth investigation.,,,,,,,,,,Navigation,There is an unusual phenomenon detected nearby that may be worth exploring.,705081998,Yes,2
906001973.WEM,Jumping,"Hyperspace jump is underway, perceptual distortion effects can be mitigated by adequate hydration.",,,,,,,,,,Navigation,The hyperspace jump is currently underway. Unpleasant physical sensations such as dizziness or nausea as a result of visual or sensory distortions is absolutely normal.,906001973,Yes,2
906332741.WEM,Alert: Navigational Data Received,New data has been recieved and stored in your navigation database.,,,,,,,,,,Navigation,New navigational data has been received and stored in the navigation database.,906332741,,8
965460983.WEM,Out Of Range: Return To Base,"You are out of range of your base, some actions will not be possible until you return.",,,,,,,,,,Navigation,You have moved outside of your base's functional area. Certain construction opportunities are disabled outside the base boundary.,965460983,Yes,2
64910055.WEM,Warning,"Your check engine light is on, which is odd, because biological entities do not have engines.",,,,,,,,,,Notification,You are acting irrationally or unsustainably.,64910055,Yes,2
178898599.WEM,Warning,You should strongly reconsider your decisions.,,,,,,,,,,Notification,"You may want to rethink recent choices, negative consequences may follow if you insist on continuing with your current actions.",178898599,,2
205192151.WEM,Warning,This course of action is ill-advised.,,,,,,,,,,Notification,Your actions are not recommended and may be dangerous or inefficient.,205192151,,2
225625917.WEM,Objective Complete,"Well done, your objective has been completed, you deserve a cookie!",,,,,,,,,,Notification,A mission or assigned task has been successfully completed. A self administered food reward would be appropriate.,225625917,,2
284071635.WEM,New Assistant Acquired,A new recruit has joined your journey and you no longer qualify for the solo XP bonus.,,,,,,,,,,Notification,A new recruit has joined your journey.,284071635,Yes,2
328948003.WEM,Warning,Failure to reconsider the decisions leading up to this point could result in a non-optimal outcome regarding your health and wellbeing.,,,,,,,,,,Notification,Continued poor decision making could lead to your harm or disadvantage.,328948003,,2
582370014.WEM,Assistant Recruited,A new recruit has arrived to assist you on your journey.,,,,,,,,,,Notification,A new recruit has joined your journey to provide support. Avoid personal pronouns.,582370014,Yes,2
599588736.WEM,Warning,Persisting in current actions may result in a system bounty placed on your identity.,,,,,,,,,,Notification,Your actions may attract unwelcome attention from local authorities.,599588736,,2
811360087.WEM,New Assistant Recruited,A new recruit has arrived and will immediately undertake unpleasant duties.,,,,,,,,,,Notification,A new intern has been recruited and will immediately be directed to take on unpleasant duties.,811360087,Yes,2
1003218333.WEM,Warning,Unspecified warning has been triggered.,,,,,,,,,,Notification,A non-specific alert has been activated.,1003218333,,2
1015651622.WEM,Warning,Continung this course of action will likely be counterproductive.,,,,,,,,,,Notification,Your current behavior may hinder progress or cause problems.,1015651622,,2
228408571.WEM,Warning,A tactical retreat is advised.,,,,,,,,,,Notification,Consider disengaging and retreating from the current situation for safety or strategic advantage.,228408571,,2
72116738.wem,Sentinels Arrived,Hostile Sentinels have arrived at your location.,,,,,,,,,,Personal Combat,Sentinel enemy units have reached the current location and are preparing to attack you.,72116738,Yes,2
78601477.WEM,Warning: Sentinel Walker Detected,"A hostile Sentinel walker has been dropped to your position, arrival imminent.",,,,,,,,,,Personal Combat,"A hostile large-scale heavily armed and armoured Sentinel unit is arriving, via being dropped from a ship in orbit.",78601477,Yes,4
90482995.WEM,Hostiles Approaching,"Hostile force is approaching, you are their target.",,,,,,,,,,Personal Combat,Hostile forces are approaching rapidly. Prepare for confrontation.,90482995,,2
486861530.WEM,Warning: Elite Sentinel Force,Unfriendly elite Sentinels are on the way.,,,,,,,,,,Personal Combat,A high-level hostile Sentinel unit is approaching.,486861530,Yes,4
540684729.wem,Sentinel force deactivated,The local sentinel network has been rendered inoperable.,,,,,,,,,,Personal Combat,Hostile Sentinel network in the area is temporarily no longer active or functioning.,540684729,Yes,2
673620140.WEM,Warning: Sentinels Engaged,Hostile sentinels have been engaged.,,,,,,,,,,Personal Combat,You are actively in combat with hostile Sentinel units.,673620140,Yes,4
27999850.WEM,Shield Protection Falling,Your shield is taking repeated damage.,,,,,,,,,,Personal Protection,"Your shield is actively being degraded by continuous damage while attepting to keep you from harm. While this is exactly what the sheild is designed to do, a sustained barrage such as this will cause it to fail completely and expose you to danger.",27999850,,2
28276028.WEM,Life Support Critical,"Life support power is critically low, suit and systems shutdown is imminent.",,,,,,,,,,Personal Protection,"Life support power has dropped to critical levels, risking imminent shutdown of suit systems and equipment functions. Complete failure greatly increases your likelihood of demise.",28276028,Yes,2
53870591.WEM,Radiation Protection Offline,Your suit can no longer protect against radiation.,,,,,,,,,,Personal Protection,"The suit's radiation shielding has completely failed, you are now unable to mitigates the effects of radiation exposure. ",53870591,Yes,2
54980060.WEM,Radiation Protection Falling,Your suit ability to prevent radiation damage is compromised.,,,,,,,,,,Personal Protection,"The suit’s radiation shielding is degrading, leaving you increasingly vulnerable.",54980060,Yes,17
56102735.WEM,Danger: Critical Hypothermia,"Extreme cold has overwhelmed your life support, onset of hypothermia has begun.",,,,,,,,,,Personal Protection,"Extreme cold conditions have overwhelmed your life support system, and hypothermia has begun, failure to address this may be fatal.",56102735,Yes,2
67834502.WEM,Shields Down,Your shields are down. Further damage taken will be life threatening.,,,,,,,,,,Personal Protection,Shields have failed entirely; you are vulnerable to health loss and system damage.,67834502,Yes,2
151182894.WEM,Toxic Protection Offline,"Toxic protection offline, it will take a long time for you to expire and it will be unpleasant the entire time it is happening.",,,,,,,,,,Personal Protection,Suit protection no longer blocks toxic exposure; severe and prolonged damage is expected.,151182894,Yes,2
258814940.WEM,Radiation Levels Critical,"You are accumulating radiation sickness symptoms at an alarming rate, failure to mitigate will result in fatal consequences.",,,,,,,,,,Personal Protection,"Radiation exposure has reached a critical threshold, continued exposure could prove fatal.",258814940,Yes,2
272020218.WEM,Shield Down,Your shield energy has depleted and caused a full shut-down.,,,,,,,,,,Personal Protection,Shield systems are offline due to complete energy depletion. Defensive capability is lost.,272020218,,2
306112359.WEM,Damage Sustained,Small to moderate damage has been inflicted on your body.,,,,,,,,,,Personal Protection,Your body has sustained small to moderate physical damage.,306112359,,2
335483997.WEM,Toxic Protection Stabilizing,"Toxic protection module is stabilizing, automatic filter purge underway.",,,,,,,,,,Personal Protection,Decontamination protocols activating; toxic shielding is regaining function.,335483997,Yes,4
394683190.WEM,Shield Down,"Your shield has been breached and taken offline, avoiding damage can typically prevent this from happening.",,,,,,,,,,Personal Protection,Your shield system has failed due to taking damage.,394683190,,2
468585602.WEM,Shield Down,"Your shield energy has been depleted, immediate energy cell recharge required.",,,,,,,,,,Personal Protection,Energy levels in the shield system are empty. Recharge is required.,468585602,,2
472945351.WEM,Radiation Protection Stabilizing,Your radiation protection ability is recovering.,,,,,,,,,,Personal Protection,The suit’s radiation protection is returning to normal operational levels. ,472945351,Yes,5
498474774.WEM,Toxicity Levels Critical,"Suit breach, Toxic levels rising, fatal exposure imminent.",,,,,,,,,,Personal Protection,Toxic contamination has reached near-fatal levels; immediate safety action required.,498474774,Yes,2
512212065.WEM,Oxygen Levels Critical,Oxygen levels are critically low and your face is turning an alarming shade of blue.,,,,,,,,,,Personal Protection,"Your oxygen supply is nearly depleted, with a corresponding immediate risk of suffocation. ",512212065,Yes,2
543874217.WEM,Danger: Heat Levels Critical,"Critical heat levels have bypassed your protections, high temperature levels are life-threatening.",,,,,,,,,,Personal Protection,"Critical heat levels have bypassed your protective systems, resulting in life-threatening high temperatures.",543874217,Yes,2
580370729.WEM,Extreme Heat Damage Detected,"Extreme heat damage detected, failure to mitigate high temperatures may result in your becoming a crispy critter.",,,,,,,,,,Personal Protection,"Extreme heat damage has been detected; failure to mitigate this will cause severe harm to you, possibly fatal. ",580370729,Yes,2
647699088.WEM,Extreme Heat: Critical,You are failing to mitigate extreme heat conditions and continued exposure will result in total carbonization.,,,,,,,,,,Personal Protection,You are currently unable to cope with critical heat conditions. Continued exposure will result in total failure or destruction of the suit and your physical self.,647699088,Yes,2
691940593.WEM,Shield Protection Stabilizing,"Your sheild has stopped taking damage, your suit systems are stabilizing, self repair systems engaged.",,,,,,,,,,Personal Protection,Suit systems recovering from recent damage; shield stabilization underway; safety state re-established.,691940593,Yes,2
768295468.WEM,Danger: Low Oxygen Levels,The suit is nearly out of breathable oxygen.,,,,,,,,,,Personal Protection,Your suit is nearly depleted of breathable oxygen.,768295468,Yes,2
781094525.WEM,Danger: Shield Compromisedfemale voicefemale voicefemale voice,The suit kinetic protection field has failed and will no longer mitigate physical injury.,,,,,,,,,,Personal Protection,The suit’s kinetic protection field has failed and can no longer mitigate physical injury.,781094525,Yes,2
797567920.WEM,Toxic Protection Falling,The suit ability to prevent toxic damage has been compromised.,,,,,,,,,,Personal Protection,Toxic shielding is weakening; damage from environmental poisons will increase.,797567920,,13
808789373.WEM,Life Support Systems Activated,"Life Support Systems Active, your bio-signature is registered, may you have better luck with this suit than the previous user.",,,,,,,,,,Personal Protection,Life support systems have activated and registered your bio-signature. ,808789373,Yes,3
825969836.WEM,Life Support Power Low,"Life support power has significantly depleted, failure to mitigate may result in your shutdown sequence.",,,,,,,,,,Personal Protection,Life support power is significantly depleted. Failure to take corrective action will result in your death.,825969836,Yes,2
865668553.wem,Life support level falling,"Life support failing, recharge immediately to avoid fatal consequences.",,,,,,,,,,Personal Protection,Life support power is dangerously low and must be restored to prevent death.,865668553,YesNo,2
871932351.WEM,Shield Down,"Critical damage has been sustained by your shields, protective capabilites are reduced to zero.",,,,,,,,,,Personal Protection,Critical incoming damage has destroyed all shield integrity.,871932351,,2
899320928.WEM,Thermal Protection Offline,Thermal protection is no longer functional and you will be subjected to unpleasant extreme temperature effects.,,,,,,,,,,Personal Protection,Thermal defense has failed; further exposure to extreme environmental temperatures will affect your health.,899320928,Yes,2
943635243.WEM,Critical Damage Taken,Massive non-trivial damage has been inflicted on your body.,,,,,,,,,,Personal Protection,Significant physical damage has been inflicted on your body.,943635243,Yes,3
957514183.WEM,Danger: Radiation Breach,Shielding against radiation has overloaded and failed. Irreperable chromosonal damage is a possibility.,,,,,,,,,,Personal Protection,"Radiation shielding has overloaded and failed, risking irreparable biological damage. ",957514183,Yes,2
968836370.WEM,Extreme Cold Damage Detected,You are taking serious damage from extreme cold.,,,,,,,,,,Personal Protection,You are sustaining serious damage due to exposure to extreme cold conditions. ,968836370,Yes,2
973658086.WEM,Danger: Toxic Rain Breach,Life-threatening toxic elements have entered the suit.,,,,,,,,,,Personal Protection,"Life-threatening toxic substances have breached the suit’s protective barriers, posing immediate danger to your health. The suit’s systems are actively attempting to contain this toxic exposure.",973658086,Yes,2
1061736374.WEM,Life Support Offline,"Life support power is now offline, suit and systems are shutting down, your shutdown will proceed momentarily.",,,,,,,,,,Personal Protection,"Life support systems are now offline, and suit systems are shutting down. Regaining consciousness will be very unlikely.",1061736374,Yes,2
1063828486.WEM,Toxic Damage Detected,"Toxic Damage Detected, likelyhood of nausea increasing.",,,,,,,,,,Personal Protection,Environmental toxins detected; exposure may cause physical side effects.,1063828486,Yes,2
28199458.WEM,Hostile System: Weapons Engaged,This star system is controlled by hostile forces. your spaceship has automatically enabled weapons in response.,,,,,,,,,,Starship Combat,"Hostile forces have already initiated combat with local defenses in the system prior to your arrival, and your starship has activated it's own weapons automatically.",28199458,Yes,2
49616634.wem,Engaging Attack Ships,Attacking ships have been automatically tagged by your combat computer.,,,,,,,,,,Starship Combat,Attacking starships have been marked as valid weapon targets for you by the combat computer.,49616634,Yes,2
162710077.wem,Sentinel Starships Inbound,Sentinel starships are on an intercept course to your position.,,,,,,,,,,Starship Combat,Hostile Sentinel starships are approaching to intercept you.,162710077,,2
205039265.WEM,New Bounty Available,There is a new bounty posted by the mercenaries guild.,,,,,,,,,,Starship Combat,A new bounty is available from the Mercenaries Guild to address a local threat.,205039265,Yes,2
310439562.WEM,Warning: Sentinel Interceptors Incoming,Sentinel air support forces are Incoming,,,,,,,,,,Starship Combat,Airborne Sentinel reinforcements are inbound to engage you.,310439562,Yes,2
472197709.WEM,Target Acquired,A target has been acquired by your weapon system.,,,,,,,,,,Starship Combat,A valid target is now being tracked by your starship combat computer.,472197709,,2
494454783.WEM,Pirate Ship At Large: Bounty Available,"A space-pirate ship is at large in this system, a bounty has been declared by the local mercenaries guild.",,,,,,,,,,Starship Combat,A hostile target is roaming this solar system and has an active bounty placed on it by local authorites.,494454783,Yes,2
510448383.WEM,Target Locked,Your weapons have locked on to your target.,,,,,,,,,,Starship Combat,Target lock established; weapons ready to fire with high accuracy.,510448383,,2
514543818.WEM,Pirate Spotted: Bounty Available,"Nearby pirate activity detected, signature matches that of a local posted bounty.",,,,,,,,,,Starship Combat,"Pirate activity has been detected near you, with a confirmed bounty match. ",514543818,Yes,2
594696652.wem,Sentinel ships in combat range,Sentinel ships are within your weapons range.,,,,,,,,,,Starship Combat,Hostile Sentinel ships are close enough to engage with weapons.,594696652,Yes,2
797446331.WEM,Hostile System: Engage Weapons,"This star system is under control of hostiles, prepare for immediate combat.",,,,,,,,,,Starship Combat,"The star system is under hostile control, and weapons systems must be engaged immediately as the occupiers have detected you and are already responding.",797446331,Yes,2
984473045.WEM,Warning: Hostile System,"This star system is under hostile control, occupiers are intolerant of trespassers.",,,,,,,,,,Starship Combat,You have entered a hostile-controlled star system where enemies will likely attack.,984473045,Yes,2
13628945.wem,Atmospheric interference,Planetary atmosphere is interfering with your Maneuver.,,,,,,,,,,Starship Movement,"A zero-gravity maneuver is being attempted, however you are within the limits of a planetary atmosphere. Safety protocols have been engaged to prevent widespread damage to the local environment, requiring repositioning beyond the planet's atmosphere before attempting again.",13628945,Yes,2
137307545.wem,Station Proximity,"You are too close to the space station, relocate immediately.",,,,,,,,,,Starship Movement,"Proximity to the space station is preventing certain starship functions, requiring immediate relocation before attempting again.",137307545,,2
